{
  "id": "iron-ghost",
  "name": "Iron Ghost",
  "description": "Стелс без права на ошибку: замечен — считай, проиграл. Мана не восстанавливается сама, бой смертелен для обеих сторон.",
  "intent": "Игра должна перестать прощать шум. В оригинале обнаружение — это неудобство, которое лечится боем; здесь оно должно ощущаться как провал, а способности — как расходник, который жалко тратить.",
  "needs_native": true,
  "overrides": [
    {
      "file": "Player.ini",
      "section": "ЗАПОЛНИТЬ ПОСЛЕ HARVEST",
      "key": "ЗАПОЛНИТЬ ПОСЛЕ HARVEST",
      "value": "0.0",
      "note": "Регенерация маны в ноль: способности становятся расходником, эликсиры — валютой.",
      "unverified": true
    },
    {
      "file": "AI.ini",
      "section": "ЗАПОЛНИТЬ ПОСЛЕ HARVEST",
      "key": "ЗАПОЛНИТЬ ПОСЛЕ HARVEST",
      "value": "0.25",
      "note": "Время до полного обнаружения вчетверо короче: выглянул из укрытия — увидели.",
      "unverified": true
    },
    {
      "file": "Weapon.ini",
      "section": "ЗАПОЛНИТЬ ПОСЛЕ HARVEST",
      "key": "ЗАПОЛНИТЬ ПОСЛЕ HARVEST",
      "value": "10.0",
      "note": "Урон по игроку кратно выше: два удара стражника — смерть.",
      "unverified": true
    }
  ]
}
